{
  "scenario_id": "S12",
  "scenario_name": "FIR-Centric Robbery Investigation",
  "scenario_type": "FIR_CENTRIC",
  "master_timeline": [
    {
      "step": 1,
      "event_id": "EVT-S02-001",
      "timestamp": "2026-08-20T13:00:00Z",
      "event_type": "FIR_INCIDENT",
      "description": "Robbery at market. Victim reports loss.",
      "entity_ids": [
        "PER-S02-000"
      ],
      "location_id": "LOC-S02-000",
      "supporting_evidence_records": [
        "FIR-S02-001"
      ]
    },
    {
      "step": 2,
      "event_id": "EVT-S02-002",
      "timestamp": "2026-08-20T13:05:00Z",
      "event_type": "SUSPECT_VEHICLE_ANPR",
      "description": "Vehicle DL01NQ8167 captured near crime scene.",
      "entity_ids": [
        "PER-S02-001",
        "VEH-S02-001"
      ],
      "location_id": "LOC-S02-000",
      "supporting_evidence_records": [
        "ANPR-S02-00001"
      ]
    },
    {
      "step": 3,
      "event_id": "EVT-S02-003",
      "timestamp": "2026-08-20T13:07:00Z",
      "event_type": "DISTRACTOR_VEHICLE_ANPR",
      "description": "Vehicle DL12QM6944 (same model) also seen near area.",
      "entity_ids": [
        "PER-S02-002",
        "VEH-S02-002"
      ],
      "location_id": "LOC-S02-000",
      "supporting_evidence_records": [
        "ANPR-S02-00002"
      ]
    },
    {
      "step": 4,
      "event_id": "EVT-S02-004",
      "timestamp": "2026-08-20T14:30:00Z",
      "event_type": "SUSPECT_CALL",
      "description": "Meena Choudhury calls co-accused Ashok Joshi post-incident.",
      "entity_ids": [
        "PER-S02-001",
        "PER-S02-005"
      ],
      "location_id": null,
      "supporting_evidence_records": [
        "CDR-S02-00001"
      ]
    },
    {
      "step": 5,
      "event_id": "EVT-S02-005",
      "timestamp": "2026-08-20T15:00:00Z",
      "event_type": "FINANCIAL_MOVE",
      "description": "Funds transferred to Ashok Joshi's account.",
      "entity_ids": [
        "PER-S02-001",
        "PER-S02-005",
        "ACC-S02-005"
      ],
      "location_id": null,
      "supporting_evidence_records": [
        "CBS-S02-00001"
      ]
    },
    {
      "step": 6,
      "event_id": "EVT-S02-006",
      "timestamp": "2026-08-20T16:00:00Z",
      "event_type": "WITNESS_STATEMENT",
      "description": "Witness Karan Mukherjee describes suspect matching Meena Choudhury.",
      "entity_ids": [
        "PER-S02-003",
        "PER-S02-001"
      ],
      "location_id": "LOC-S02-000",
      "supporting_evidence_records": [
        "FIR-S02-001"
      ]
    }
  ],
  "ground_truth_entities": [
    {
      "canonical_id": "PER-S02-000",
      "role_in_scenario": "BENIGN_PERSON",
      "real_name": "Nikhil Bhatia",
      "associated_sources": [
        "cctns_fir_records.json"
      ]
    },
    {
      "canonical_id": "PER-S02-001",
      "role_in_scenario": "MASTERMIND",
      "real_name": "Meena Choudhury",
      "associated_sources": [
        "cctns_fir_records.json",
        "telecom_cdr_logs.csv",
        "toll_anpr_logs.csv"
      ]
    },
    {
      "canonical_id": "PER-S02-002",
      "role_in_scenario": "DISTRACTOR",
      "real_name": "Ramesh Bansal",
      "associated_sources": [
        "cctns_fir_records.json",
        "toll_anpr_logs.csv"
      ]
    },
    {
      "canonical_id": "PER-S02-003",
      "role_in_scenario": "BENIGN_PERSON",
      "real_name": "Karan Mukherjee",
      "associated_sources": [
        "cctns_fir_records.json"
      ]
    },
    {
      "canonical_id": "PER-S02-004",
      "role_in_scenario": "BENIGN_PERSON",
      "real_name": "Ankit Rao",
      "associated_sources": [
        "cctns_fir_records.json"
      ]
    },
    {
      "canonical_id": "PER-S02-005",
      "role_in_scenario": "ASSOCIATE",
      "real_name": "Ashok Joshi",
      "associated_sources": [
        "telecom_cdr_logs.csv",
        "cbs_bank_transactions.csv"
      ]
    }
  ],
  "ground_truth_relationships": [
    {
      "edge_id": "S02-E001",
      "source_entity": "PER-S02-001",
      "target_entity": "PER-S02-000",
      "relationship_type": "PERPETRATOR_OF",
      "is_direct_or_inferred": "INFERRED",
      "evidence_path": [
        {
          "source": "cctns_fir_records.json",
          "record_id": "FIR-S02-001"
        },
        {
          "source": "toll_anpr_logs.csv",
          "record_id": "ANPR-S02-00001"
        }
      ],
      "ground_truth_confidence": 0.9,
      "temporal_start": null,
      "temporal_end": null
    },
    {
      "edge_id": "S02-E002",
      "source_entity": "PER-S02-001",
      "target_entity": "VEH-S02-001",
      "relationship_type": "DRIVES",
      "is_direct_or_inferred": "DIRECT",
      "evidence_path": [
        {
          "source": "toll_anpr_logs.csv",
          "record_id": "ANPR-S02-00001"
        }
      ],
      "ground_truth_confidence": 0.9,
      "temporal_start": null,
      "temporal_end": null
    },
    {
      "edge_id": "S02-E003",
      "source_entity": "PER-S02-001",
      "target_entity": "PER-S02-005",
      "relationship_type": "COMMUNICATES_WITH",
      "is_direct_or_inferred": "INFERRED",
      "evidence_path": [
        {
          "source": "telecom_cdr_logs.csv",
          "record_id": "CDR-S02-00001"
        }
      ],
      "ground_truth_confidence": 0.9,
      "temporal_start": null,
      "temporal_end": null
    },
    {
      "edge_id": "S02-E004",
      "source_entity": "PER-S02-001",
      "target_entity": "ACC-S02-001",
      "relationship_type": "OWNS_ACCOUNT",
      "is_direct_or_inferred": "DIRECT",
      "evidence_path": [
        {
          "source": "cbs_bank_transactions.csv",
          "record_id": "CBS-S02-00001"
        }
      ],
      "ground_truth_confidence": 0.9,
      "temporal_start": null,
      "temporal_end": null
    },
    {
      "edge_id": "S02-E005",
      "source_entity": "PER-S02-005",
      "target_entity": "ACC-S02-005",
      "relationship_type": "RECEIVES_FUNDS",
      "is_direct_or_inferred": "INFERRED",
      "evidence_path": [
        {
          "source": "cbs_bank_transactions.csv",
          "record_id": "CBS-S02-00001"
        }
      ],
      "ground_truth_confidence": 0.9,
      "temporal_start": null,
      "temporal_end": null
    },
    {
      "edge_id": "S02-E006",
      "source_entity": "PER-S02-003",
      "target_entity": "LOC-S02-000",
      "relationship_type": "WITNESS_AT",
      "is_direct_or_inferred": "DIRECT",
      "evidence_path": [
        {
          "source": "cctns_fir_records.json",
          "record_id": "FIR-S02-001"
        }
      ],
      "ground_truth_confidence": 0.9,
      "temporal_start": null,
      "temporal_end": null
    },
    {
      "edge_id": "S02-E007",
      "source_entity": "PER-S02-004",
      "target_entity": "LOC-S02-000",
      "relationship_type": "WITNESS_AT",
      "is_direct_or_inferred": "DIRECT",
      "evidence_path": [
        {
          "source": "cctns_fir_records.json",
          "record_id": "FIR-S02-001"
        }
      ],
      "ground_truth_confidence": 0.9,
      "temporal_start": null,
      "temporal_end": null
    },
    {
      "edge_id": "S02-E008",
      "source_entity": "PER-S02-002",
      "target_entity": "LOC-S02-000",
      "relationship_type": "NEARBY_BENIGN",
      "is_direct_or_inferred": "DIRECT",
      "evidence_path": [
        {
          "source": "toll_anpr_logs.csv",
          "record_id": "ANPR-S02-00002"
        }
      ],
      "ground_truth_confidence": 0.1,
      "temporal_start": null,
      "temporal_end": null
    },
    {
      "edge_id": "S02-E009",
      "source_entity": "PER-S02-001",
      "target_entity": "LOC-S02-000",
      "relationship_type": "PRESENT_AT_SCENE",
      "is_direct_or_inferred": "INFERRED",
      "evidence_path": [
        {
          "source": "cell_tower_dumps.json",
          "record_id": "TDUMP-S02-0001"
        },
        {
          "source": "toll_anpr_logs.csv",
          "record_id": "ANPR-S02-00001"
        }
      ],
      "ground_truth_confidence": 0.9,
      "temporal_start": null,
      "temporal_end": null
    },
    {
      "edge_id": "S02-E010",
      "source_entity": "PER-S02-000",
      "target_entity": "ACC-S02-000",
      "relationship_type": "VICTIM_ACCOUNT",
      "is_direct_or_inferred": "DIRECT",
      "evidence_path": [
        {
          "source": "cbs_bank_transactions.csv",
          "record_id": "CBS-S02-00002"
        }
      ],
      "ground_truth_confidence": 0.9,
      "temporal_start": null,
      "temporal_end": null
    }
  ]
}