{
  "scenario_id": "S16",
  "scenario_name": "Cell Tower Dump Filtering",
  "scenario_type": "TOWER_DUMP_FILTERING",
  "master_timeline": [
    {
      "step": 1,
      "event_id": "EVT-S06-001",
      "timestamp": "2026-08-22T07:30:00Z",
      "event_type": "TOWER_DUMP_WINDOW_START",
      "description": "Tower TOWER-DL-CP-101 active. 122 MSISDNs present in window.",
      "entity_ids": [
        "PER-S06-000",
        "PER-S06-001",
        "PER-S06-002"
      ],
      "location_id": "LOC-S06-000",
      "supporting_evidence_records": [
        "TDUMP-S06-0001"
      ]
    },
    {
      "step": 2,
      "event_id": "EVT-S06-002",
      "timestamp": "2026-08-22T08:00:00Z",
      "event_type": "SUSPECT_COMMUNICATION",
      "description": "Priya Reddy calls Rohit Pandey while at tower.",
      "entity_ids": [
        "PER-S06-000",
        "PER-S06-001"
      ],
      "location_id": "LOC-S06-000",
      "supporting_evidence_records": [
        "CDR-S06-00001"
      ]
    },
    {
      "step": 3,
      "event_id": "EVT-S06-003",
      "timestamp": "2026-08-22T08:15:00Z",
      "event_type": "MEETING_AT_TOWER",
      "description": "Priya Reddy meets Dhruv Singh near tower location.",
      "entity_ids": [
        "PER-S06-000",
        "PER-S06-002"
      ],
      "location_id": "LOC-S06-000",
      "supporting_evidence_records": [
        "FNOTE-S06-0001"
      ]
    },
    {
      "step": 4,
      "event_id": "EVT-S06-004",
      "timestamp": "2026-08-22T09:00:00Z",
      "event_type": "CRIME_EVENT",
      "description": "Snatching incident reported in vicinity.",
      "entity_ids": [
        "PER-S06-000",
        "PER-S06-002"
      ],
      "location_id": "LOC-S06-000",
      "supporting_evidence_records": [
        "FIR-S06-001"
      ]
    },
    {
      "step": 5,
      "event_id": "EVT-S06-005",
      "timestamp": "2026-08-22T09:30:00Z",
      "event_type": "FINANCIAL_ACTIVITY",
      "description": "Priya Reddy transfers funds post-crime.",
      "entity_ids": [
        "PER-S06-000",
        "PER-S06-001",
        "ACC-S06-000",
        "ACC-S06-001"
      ],
      "location_id": null,
      "supporting_evidence_records": [
        "CBS-S06-00001",
        "FIU-S06-0001"
      ]
    }
  ],
  "ground_truth_entities": [
    {
      "canonical_id": "PER-S06-000",
      "role_in_scenario": "MASTERMIND",
      "real_name": "Priya Reddy",
      "associated_sources": [
        "telecom_cdr_logs.csv",
        "cbs_bank_transactions.csv",
        "cell_tower_dumps.json"
      ]
    },
    {
      "canonical_id": "PER-S06-001",
      "role_in_scenario": "ASSOCIATE",
      "real_name": "Rohit Pandey",
      "associated_sources": [
        "telecom_cdr_logs.csv",
        "cell_tower_dumps.json"
      ]
    },
    {
      "canonical_id": "PER-S06-002",
      "role_in_scenario": "ASSOCIATE",
      "real_name": "Dhruv Singh",
      "associated_sources": [
        "cell_tower_dumps.json",
        "cctns_fir_records.json"
      ]
    },
    {
      "canonical_id": "PER-S06-003",
      "role_in_scenario": "DISTRACTOR",
      "real_name": "Lata Kapoor",
      "associated_sources": [
        "cell_tower_dumps.json"
      ]
    },
    {
      "canonical_id": "PER-S06-004",
      "role_in_scenario": "DISTRACTOR",
      "real_name": "Vikram Sharma",
      "associated_sources": [
        "cell_tower_dumps.json"
      ]
    }
  ],
  "ground_truth_relationships": [
    {
      "edge_id": "S06-E001",
      "source_entity": "PER-S06-000",
      "target_entity": "PER-S06-001",
      "relationship_type": "COMMUNICATES_WITH",
      "is_direct_or_inferred": "INFERRED",
      "evidence_path": [
        {
          "source": "telecom_cdr_logs.csv",
          "record_id": "CDR-S06-00001"
        },
        {
          "source": "cell_tower_dumps.json",
          "record_id": "TDUMP-S06-0001"
        }
      ],
      "ground_truth_confidence": 0.9,
      "temporal_start": null,
      "temporal_end": null
    },
    {
      "edge_id": "S06-E002",
      "source_entity": "PER-S06-000",
      "target_entity": "PER-S06-002",
      "relationship_type": "MEETS_AT_TOWER",
      "is_direct_or_inferred": "INFERRED",
      "evidence_path": [
        {
          "source": "cell_tower_dumps.json",
          "record_id": "TDUMP-S06-0001"
        },
        {
          "source": "field_intelligence_notes.txt",
          "record_id": "FNOTE-S06-0001"
        }
      ],
      "ground_truth_confidence": 0.9,
      "temporal_start": null,
      "temporal_end": null
    },
    {
      "edge_id": "S06-E003",
      "source_entity": "PER-S06-000",
      "target_entity": "LOC-S06-000",
      "relationship_type": "PRESENT_AT",
      "is_direct_or_inferred": "DIRECT",
      "evidence_path": [
        {
          "source": "cell_tower_dumps.json",
          "record_id": "TDUMP-S06-0001"
        }
      ],
      "ground_truth_confidence": 0.9,
      "temporal_start": null,
      "temporal_end": null
    },
    {
      "edge_id": "S06-E004",
      "source_entity": "PER-S06-001",
      "target_entity": "LOC-S06-000",
      "relationship_type": "PRESENT_AT",
      "is_direct_or_inferred": "DIRECT",
      "evidence_path": [
        {
          "source": "cell_tower_dumps.json",
          "record_id": "TDUMP-S06-0001"
        }
      ],
      "ground_truth_confidence": 0.9,
      "temporal_start": null,
      "temporal_end": null
    },
    {
      "edge_id": "S06-E005",
      "source_entity": "PER-S06-002",
      "target_entity": "LOC-S06-000",
      "relationship_type": "PRESENT_AT",
      "is_direct_or_inferred": "DIRECT",
      "evidence_path": [
        {
          "source": "cell_tower_dumps.json",
          "record_id": "TDUMP-S06-0001"
        },
        {
          "source": "cctns_fir_records.json",
          "record_id": "FIR-S06-001"
        }
      ],
      "ground_truth_confidence": 0.9,
      "temporal_start": null,
      "temporal_end": null
    },
    {
      "edge_id": "S06-E006",
      "source_entity": "PER-S06-000",
      "target_entity": "ACC-S06-000",
      "relationship_type": "OWNS_ACCOUNT",
      "is_direct_or_inferred": "DIRECT",
      "evidence_path": [
        {
          "source": "cbs_bank_transactions.csv",
          "record_id": "CBS-S06-00001"
        }
      ],
      "ground_truth_confidence": 0.9,
      "temporal_start": null,
      "temporal_end": null
    },
    {
      "edge_id": "S06-E007",
      "source_entity": "PER-S06-000",
      "target_entity": "ACC-S06-001",
      "relationship_type": "TRANSFERS_FUNDS",
      "is_direct_or_inferred": "INFERRED",
      "evidence_path": [
        {
          "source": "cbs_bank_transactions.csv",
          "record_id": "CBS-S06-00001"
        },
        {
          "source": "fiu_str_alerts.json",
          "record_id": "FIU-S06-0001"
        }
      ],
      "ground_truth_confidence": 0.9,
      "temporal_start": null,
      "temporal_end": null
    },
    {
      "edge_id": "S06-E008",
      "source_entity": "PER-S06-003",
      "target_entity": "LOC-S06-000",
      "relationship_type": "CO_LOCATED_ONLY",
      "is_direct_or_inferred": "DIRECT",
      "evidence_path": [
        {
          "source": "cell_tower_dumps.json",
          "record_id": "TDUMP-S06-0001"
        }
      ],
      "ground_truth_confidence": 0.03,
      "temporal_start": null,
      "temporal_end": null
    },
    {
      "edge_id": "S06-E009",
      "source_entity": "PER-S06-004",
      "target_entity": "LOC-S06-000",
      "relationship_type": "CO_LOCATED_ONLY",
      "is_direct_or_inferred": "DIRECT",
      "evidence_path": [
        {
          "source": "cell_tower_dumps.json",
          "record_id": "TDUMP-S06-0001"
        }
      ],
      "ground_truth_confidence": 0.03,
      "temporal_start": null,
      "temporal_end": null
    }
  ]
}